title,label,description,upload_hour,likes,dislikes,comments
cook pasta ten minutes,legit,learn cook delicious pasta ten minute experience needed,20.0,0.29,0.21,0.4
free iphone giveaway click,scam,claim free iphone visit detail http://scam-website.com,11.0,0.99,0.99,0.09
win brand new tesla enter,scam,chance win tesla visit http://tesla-giveaway.com,11.0,0.38,0.36,0.08
discover secrets success,legit,explore proven strategy achieving personal professional success,10.0,0.11,0.08,0.81
warning account compromised,scam,secure account http://security-alert.com,21.0,0.47,0.58,0.56
learn python programming beginner advanced,legit,master python stepbystep guide start coding today,0.0,0.37,0.85,0.8
get rich quick simple trick,scam,discover secret formula wealth info http://fakeprofits.net,15.0,0.5,0.52,0.19
five easy exercises healthier life,legit,quick effective exercise boost health fitness,13.0,0.5,0.37,0.01
click claim reward,scam,exclusive prize waiting claim http://reward-link.com,19.0,0.68,0.13,0.85
shocking discovery banks dont want know,scam,learn truth http://bank-secrets.com,15.0,0.54,0.3,0.5
computer risk fix,scam,fix system vulnerability http://quickfix.com,2.0,0.12,0.32,0.54
top ten travel destinations two thousand and twenty-four,legit,explore beautiful travel spot two thousand and twenty-four plan trip,19.0,0.5,0.52,0.05
account deleted twenty-four hours,scam,immediate action required secure account http://urgentfix.net,22.0,0.23,0.42,0.3
ten facts didnt know space,legit,learn amazing fact space universe,4.0,1.0,0.74,0.49
become python expert thirty days,legit,intensive python course designed make expert one month,19.0,0.39,0.05,0.48
immediate action required secure funds,scam,protect fund follow link http://safe-bank.com,10.0,0.87,0.89,0.21
new ai technology changes everything,legit,explore groundbreaking ai innovation changing world,8.0,0.07,0.02,0.52
congratulations youve one thousand gift card,scam,claim one thousand gift card http://prizezone.net,16.0,0.13,0.4,0.76
get brand new laptop free,scam,claim free laptop http://free-laptop.org,13.0,0.1,0.67,0.59
understanding machine learning algorithms,legit,discover basic ml algorithm work,8.0,0.43,0.34,0.96
win free gift card limited time,scam,dont miss click http://freeswag.com,15.0,0.31,0.26,0.36
master art public speaking,legit,enhance public speaking skill proven technique,4.0,0.02,0.5,0.68
credit score danger click,scam,fix credit score immediately http://credit-fix.net,2.0,0.37,0.34,0.77
exclusive offer double money instantly,scam,double saving instantly click http://fast-doubles.com,14.0,0.19,0.97,0.91
tips successful job interview,legit,practical advice excelling next job interview,18.0,0.93,0.27,0.94
youve click claim reward,scam,claim prize http://you-win.com,21.0,0.5,0.52,0.17
diy build treehouse backyard,legit,stepbystep instruction building treehouse fun family,10.0,0.25,0.54,0.72
instant approval five thousand loan,scam,get instant loan approval http://loan-fast.net,19.0,0.65,0.81,0.66
claim reward midnight,scam,reward expires soon visit http://midnight-prize.net,13.0,0.77,0.02,0.78
explore hidden wonders world,legit,embark journey discover world hidden treasure,1.0,0.3,0.83,0.31
last chance claim prize,scam,dont let chance slip away visit http://finalchance.net,6.0,0.17,0.18,0.88
unlock secret instant wealth,scam,financial freedom start http://wealth-secret.net,17.0,0.3,0.61,0.99
watch video gets removed,scam,hurry late watch http://hidden-video.net,9.0,0.51,0.2,0.57
upgrade skills tutorial,legit,boost professional skill comprehensive tutorial,14.0,0.07,0.11,0.52
earn money sleep,scam,passive income secret revealed http://moneydream.net,17.0,0.14,0.99,0.06
understanding blockchain technology,legit,learn fundamental blockchain application,16.0,0.89,0.87,0.54
earn ten thousand one day guaranteed,scam,make thousand overnight act http://quick-rich.com,2.0,0.07,0.5,0.65
win big purchase required,scam,enter win visit http://win-big.com,10.0,0.48,0.11,0.68
secret investment opportunity revealed,scam,exclusive deal await click http://invest-secrets.com,21.0,0.19,0.95,1.0
hurry limited time offer ends soon,scam,act offer expires http://final-offer.com,17.0,0.04,0.35,0.56
free money click find,scam,get free bonus learn http://free-cash.info,21.0,0.5,0.08,0.99
selected special reward,scam,visit claim reward http://exclusive-reward.com,8.0,0.67,0.04,0.95
secret formula quick money revealed,scam,start earning today http://quick-money.net,16.0,0.39,0.58,0.68
shocking discovery banks dont want know,scam,learn truth http://bank-secrets.com,14.0,0.21,0.38,0.91
top five coding languages learn two thousand and twenty-four,legit,discover indemand programming language two thousand and twenty-four,14.0,0.32,0.48,0.17
exclusive crypto trading secrets revealed,scam,discover top strategy crypto trading success http://crypto-secrets.net,17.0,0.46,0.73,0.54
upgrade skills tutorial,legit,boost skill detailed stepbystep guide,15.0,0.8,0.98,0.79
save money efficiently,legit,practical tip help manage save finance effectively,11.0,0.35,0.22,0.8
earn passive income zero investment,scam,start earning passive income today without initial investment learn http://passive-wealth.net,7.0,0.37,0.88,0.8
win free holiday package limited time,scam,claim holiday package hurry limited time offer http://freeholiday.net,9.0,0.44,0.94,0.61
healthy recipes busy people,legit,quick healthy recipe tailored busy schedule,2.0,0.17,0.54,0.76
understanding cryptocurrency basics,legit,learn essential cryptocurrency start investing,17.0,0.94,0.77,0.37
act prize waiting,scam,exclusive reward ready claim http://exclusive-reward.com,9.0,0.35,0.23,0.72
double investment overnight secret,scam,unlock secret formula doubling investment instantly,3.0,0.57,0.12,0.91
improve mental health tips,legit,simple effective tip boost mental wellbeing,6.0,0.83,0.5,0.26
master art public speaking,legit,overcome stage fright master art confident speaking,9.0,0.34,0.99,0.2
warning unauthorized login detected,scam,immediate action required secure account http://secure-login.com,2.0,0.44,0.2,0.87
top ten cities visit summer,legit,explore beautiful city summer vacation,13.0,0.87,0.88,0.8
device compromised fix immediately,scam,protect device vulnerability http://secure-device.net,7.0,0.5,0.52,0.71
last chance vip access millionaire club,scam,unlock vip access http://millionaire-club.com,17.0,0.5,0.52,0.99
understanding blockchain technology,legit,indepth look blockchain revolutionizing industry,16.0,0.77,0.36,0.19
congratulations youve selected special gift,scam,claim exclusive gift http://special-gift.net,16.0,0.49,0.94,0.18
understanding renewable energy sources,legit,explore renewable energy shaping future sustainability,16.0,0.04,0.04,0.4
pqjjlbwwsupivcnmfi9i2m8jtdw,legit,learn best strategy grow monetize youtube channel,23.0,0.33,0.77,0.34
immediate action required avoid penalties,scam,take immediate action avoid penalty details http://penalty-alert.com,18.0,0.31,0.17,0.54
top five hacks make money online instantly,scam,learn fastest way make money online,22.0,0.85,0.65,0.01
claim five hundred bonus late,scam,hurry claim five hundred bonus http://bonus-now.com,13.0,0.96,0.35,0.27
top five coding languages learn two thousand and twenty-four,legit,discover top programming language boost career two thousand and twenty-four,1.0,0.04,0.16,0.32
ultimate fitness guide beginners,legit,start fitness journey comprehensive guide,4.0,0.5,0.53,0.98
earn five thousand per week home skills needed,scam,learn earn home skill required http://work-from-home.com,16.0,0.11,0.94,0.41
comprehensive guide digital marketing,legit,master digital marketing strategy business,15.0,0.8,0.55,0.19
shocking truth online banking watch,scam,unveil shocking truth online banking http://banking-truth.net,13.0,0.5,0.32,0.18
limited slots available reserve,scam,secure slot late limited availability,22.0,0.69,0.59,0.1
explore hidden wonders world,legit,discover breathtaking place earth,22.0,0.31,0.26,0.82
best books read year,legit,curated list mustread book year,2.0,0.75,0.83,0.99
subscription suspended reactivate,scam,reactivate subscription immediately http://subscription-alert.com,11.0,0.4,0.52,0.22
tips successful job interview,legit,essential tip excel next job interview,5.0,0.15,0.88,0.52
exclusive investment tips instant wealth,scam,learn best investment tip immediate return,2.0,0.08,0.72,0.77
unboxing latest iphone model,legit,detailed unboxing review latest iphone model,5.0,0.0,0.92,0.73
plan perfect vacation,legit,stepbystep guide planning unforgettable vacation,13.0,0.74,0.7,0.32
top five skills need two thousand and twenty-four,legit,discover valuable skill thrive job market year,4.0,0.5,0.52,0.2
password leaked update,scam,immediate action required secure password immediately,22.0,0.82,0.21,0.56
ultimate guide healthy meal prep,legit,learn prepare healthy meal efficiently effectively,17.0,0.6,0.35,0.96
act avoid account suspension,scam,avoid account suspension following instruction provided,18.0,0.86,0.52,0.23
best practices learning new language,legit,master new language quickly proven strategy,6.0,0.11,0.07,0.93
unbelievable deal buy one get five free,scam,limited time offer grab deal http://exclusive-deal.net,13.0,0.5,0.77,0.28
rcurlturtae ntwaflosecf eesrseca eso hac,legit,discover key strategy launching freelance career,15.0,0.97,0.77,0.2
instant approval personal loans credit check,scam,get instant approval loan application today,10.0,0.08,0.86,0.87
understanding basics cybersecurity,legit,learn essential technique secure digital life,22.0,0.1,0.47,0.98
free gift ready shipment,scam,claim free gift expires,4.0,0.5,0.52,0.11
tips effective time management,legit,manage time better efficient productivity tip,7.0,0.39,0.71,0.92
secure account simple step,scam,protect account simple effective security tip,17.0,0.18,0.23,0.54
introduction artificial intelligence basics,legit,explore fundamental concept ai beginner guide,22.0,0.89,0.38,0.42
ten quick tips improve memory,legit,boost memory scientifically proven technique,9.0,0.5,0.81,0.37
hidden secrets get rich fast revealed,scam,discover hidden secret quick wealth,1.0,0.3,0.73,0.01
beginners guide graphic design,legit,start graphic design journey beginnerfriendly tip,8.0,0.85,0.01,0.32
exploring future renewable energy,legit,understand renewable energy shaping world,1.0,0.5,0.7,0.24
important update payment information,scam,ensure payment detail date avoid interruption,13.0,0.35,0.05,0.18
simple steps improve public speaking skills,legit,overcome stage fright speak confidently public,23.0,0.88,0.21,0.69
ten proven methods save money,legit,learn practical technique save money effectively,19.0,0.07,0.84,0.9
immediate refund available click,scam,claim refund immediately following instruction,9.0,0.29,0.56,0.54
learn fundamentals photography,legit,capture stunning photo beginnerfriendly photography tip,23.0,0.39,0.77,0.54
write winning resume,legit,craft resume stand potential employer,6.0,0.59,0.74,0.46
win prizes worth ten thousand enter today,scam,chance win big details http://win-prizes-now.com,12.0,0.44,0.11,0.03
master data science six months,legit,become data science expert comprehensive 6month guide,15.0,0.27,0.52,0.43
exclusive opportunity boss,scam,start entrepreneurial journey today,4.0,0.91,0.01,0.11
learn guitar thirty days,legit,master guitar basic one month simple guide,19.0,0.94,0.03,0.23
essential tools remote work success,legit,equip best tool remote productivity,11.0,0.62,0.52,0.23
top seven places visit europe year,legit,explore breathtaking destination europe year,11.0,0.62,0.38,0.73
shocking truth online banking watch,scam,discover surprising insight online banking practice,16.0,0.98,0.16,0.54
ultimate beginners guide yoga,legit,start yoga journey easy beginner tip,13.0,0.37,0.97,0.33
click activate free gift,scam,free gift waiting activate,5.0,0.5,0.52,0.03
simple habits productive day,legit,boost productivity simple daily habit,0.0,0.44,0.74,0.32
act quickly claim reward today,scam,reward ready dont miss,19.0,0.71,0.9,0.89
understanding cryptocurrency wallets,legit,learn manage secure cryptocurrency wallet,5.0,0.14,0.48,0.59
congratulations youve surprise gift,scam,claim surprise gift http://surprise-gift.net,3.0,0.41,0.53,0.5
exploring depths ocean documentary,legit,dive mystery deep ocean documentary,20.0,0.73,0.23,0.13
top three ways become millionaire,scam,discover secret becoming millionaire quickly,0.0,0.61,0.52,0.89
device risk fix instantly,scam,device need immediate attention secure,14.0,0.19,0.11,0.5
free access exclusive content,scam,gain access exclusive premium content,14.0,0.37,0.52,0.31
urgent verify account immediately,scam,verify account avoid disruption,15.0,0.76,0.62,0.11
earn five hundred day strategy,scam,start earning money online today proven strategy,0.0,0.94,0.85,0.54
understanding basics personal finance,legit,learn fundamental personal finance money management,21.0,0.5,0.93,0.5
get exclusive access secret wealth tips,scam,unlock exclusive tip growing wealth,10.0,0.39,0.89,0.43
immediate action required account security,scam,secure account immediately prevent unauthorized access,4.0,0.25,0.89,0.51
ten quick recipes busy weeknights,legit,prepare quick delicious meal busy evening,0.0,0.72,0.59,0.8
win luxury car one click,scam,chance win luxury car details http://luxurycar-win.net,15.0,0.2,0.89,0.79
special offer unlock premium content free,scam,unlock premium content without paying dime,13.0,0.2,0.64,0.72
build confidence social situations,legit,overcome shyness boost confidence social interaction,16.0,0.5,0.84,0.5
attention account needs verification,scam,account requires immediate verification take action,13.0,0.94,0.52,0.55
limited slots instant wealth program,scam,secure spot exclusive wealth program,19.0,0.5,0.08,0.45
free bitcoin giveaway claim,scam,claim free bitcoin today limited offer,0.0,0.91,0.11,0.96
act fast slots left,scam,limited availability secure spot,15.0,0.68,0.06,0.49
get instant approval personal loan,scam,loan ready get instant approval today,14.0,0.36,0.89,0.54
learn ethical hacking step step,legit,master ethical hacking stepbystep guide,14.0,0.33,0.44,0.96
secure future one trick,scam,protect grow future wealth simple trick,20.0,0.44,0.4,0.97
last chance claim prize,scam,prize expire claim,20.0,0.51,0.73,0.54
easy diy projects home,legit,simple fun diy project improve home,4.0,0.2,0.6,0.88
alert suspicious activity detected account,scam,suspicious activity detected secure account immediately,6.0,0.03,0.43,0.45
limited time get free bonus,scam,free bonus waiting grab,10.0,0.5,0.52,0.44
double investment overnight,scam,maximize return overnight investment strategy,16.0,0.73,0.59,0.54
shocking discovery online earnings,scam,learn shocking truth earning money online,6.0,0.5,0.07,0.58
uncover hidden investment secrets,scam,exclusive investment secret revealed,13.0,0.01,0.77,0.27
build confidence social situations,legit,improve social confidence proven strategy,6.0,0.26,0.52,0.33
get paid watching videos start today,scam,earn money online watching video today,4.0,0.89,0.03,0.45
understanding basics personal finance,legit,master personal finance foundational tip,13.0,0.56,0.43,0.56
claim free access premium tools_,scam,gain free access premium tool act late,16.0,0.57,0.84,0.67
ultimate guide gardening beginners,legit,start gardening journey easy step beginner,12.0,0.58,0.93,0.07
shocking secrets rich exposed,scam,discover hidden secret wealthy people dont want know,23.0,0.28,0.42,0.94
quick easy vegan recipes,legit,prepare tasty vegan meal minute quick recipe,19.0,0.5,0.27,0.54
top five secrets banks dont want know,scam,learn secret bank hiding,7.0,0.78,0.75,0.03
earn passive income effortlessly,scam,generate passive income simple proven method,1.0,0.37,0.45,0.94
master public speaking tips,legit,boost confidence communication tip,4.0,0.0,0.93,0.84
exclusive access fast money making tips,scam,unlock exclusive secret making money fast,22.0,0.19,0.45,0.3
master photography seven days,legit,learn photography basic start taking stunning picture one week,21.0,0.12,0.52,0.54
explore wonders space nasa,legit,join nasa exploring mystery universe,2.0,0.7,0.83,0.85
immediate refund available act fast,scam,claim refund http://refund-quick.net,16.0,0.86,0.52,0.07
ten mindfulness techniques stress relief,legit,reduce stress boost mental clarity mindfulness technique,21.0,0.65,0.87,0.56
account flagged suspicious activity,scam,immediate attention required secure account,16.0,0.63,0.26,0.69
top ten mustvisit cities europe,legit,discover beautiful city visit europe year,11.0,0.63,0.96,0.87
stepbystep guide home renovation,legit,transform home easytofollow renovation guide,8.0,0.99,0.52,0.84
attention limited time investment opportunity,scam,secure investment spot today http://invest-now.com,21.0,0.12,0.42,0.49
best hiking trails around world,legit,explore world breathtaking hiking trail,12.0,0.09,0.59,0.28
top ten mustread books entrepreneurs,legit,fuel entrepreneurial journey mustread book,19.0,0.5,1.0,0.54
warning immediate action required account,scam,account risk take immediate action secure,8.0,0.35,0.82,0.58
unlock financial freedom today,scam,discover strategy achieve financial independence,8.0,0.42,0.74,0.24
build successful online business,legit,learn proven technique building successful online business,20.0,0.21,0.4,0.97
limited offer double money instantly,scam,double investment instantly limitedtime offer,13.0,0.4,1.0,0.85
best practices cybersecurity two thousand and twenty-four,legit,protect digital life cybersecurity tip,20.0,0.64,0.54,0.62
top five tools effective project management,legit,boost productivity essential project management tool,10.0,0.47,0.52,0.72
discover secrets instant success,scam,learn shortcut achieving instant success,20.0,0.82,0.51,0.98
five daily habits healthier lifestyle,legit,adopt five daily habit healthier happier life,6.0,0.88,0.68,0.22
security risk click fix,scam,secure account http://security-fix.com,6.0,0.5,0.26,1.0
simple exercises better posture,legit,improve posture easy daily exercise,18.0,0.73,0.57,0.09
join vip club exclusive benefits,scam,gain exclusive access vip offer deal,15.0,0.18,0.64,0.54
quick cash make two hundred thirty minutes,scam,earn quick cash proven method,20.0,0.61,0.52,0.38
start earning home right,scam,work home start earning today,16.0,0.9,0.49,0.62
learn spanish thirty days beginner guide,legit,master spanish basic thirty day beginnerfriendly guide,19.0,0.41,0.69,0.57
improve digital marketing skills,legit,upgrade digital marketing expertise actionable strategy,1.0,0.38,0.88,0.72
exclusive insider trading secrets revealed,scam,get access confidential insider trading secret today,5.0,0.42,0.38,0.14
alert payment details outdated,scam,update payment detail avoid service interruption,16.0,0.32,0.51,0.89
claim instant reward,scam,reward ready claim instantly,0.0,0.65,0.63,0.52
new method get rich fast revealed,scam,unlock brandnew strategy get rich quickly,17.0,0.5,0.52,1.0
learn basic first aid skills,legit,master essential first aid skill handle emergency confidently,12.0,0.56,0.66,0.0
stepbystep guide writing novel,legit,start writing journey comprehensive novelwriting guide,22.0,0.39,0.39,0.75
exclusive deal win free ipad today,scam,chance win free ipad enter http://free-ipad.net,9.0,0.07,0.52,0.06
top five productivity tools remote work,legit,enhance workflow top productivity tool remote work,19.0,0.18,1.0,0.45
earn one thousand daily without leaving home,scam,learn make money daily without stepping outside home,2.0,0.5,0.52,0.62
ten tips becoming better writer,legit,improve writing skill practical effective tip,13.0,0.0,0.08,0.95
plan dream vacation,legit,create unforgettable travel experience vacation planning guide,22.0,0.38,0.62,0.25
best practices managing remote teams,legit,lead remote team effectively proven management strategy,19.0,0.05,0.93,0.91
stepbystep guide learning guitar,legit,learn play guitar stepbystep even youre complete beginner,1.0,0.6,0.01,0.66
bank account locked immediate action needed,scam,unlock bank account http://secure-bank.net,19.0,0.97,0.34,0.59
easy diy crafts kids,legit,fun creative craft project kid age,2.0,0.75,0.92,0.46
ten affordable smart home gadgets,legit,upgrade home budgetfriendly smart device,15.0,0.92,0.75,0.03
learn art graphic design,legit,discover essential graphic design skill unleash creativity,22.0,0.51,0.2,0.31
launch startup successfully,legit,turn business idea reality startup tip,16.0,0.61,0.03,0.56
best practices email marketing campaigns,legit,boost engagement proven email marketing strategy,9.0,0.99,0.57,0.56
top five online courses career growth,legit,advance career highly recommended online course,21.0,0.94,0.57,0.35
improve focus techniques,legit,learn eliminate distraction stay focused goal,13.0,0.24,0.1,0.06
ten science experiments home,legit,fun educational science experiment entire family,11.0,0.47,0.86,0.82
congratulations youve dream vacation,scam,claim dream vacation http://dream-vacation.net,1.0,0.81,0.64,0.8
discover best travel hacks flights,legit,save money travel smarter flight booking hack,13.0,0.81,0.94,0.32
top seven time management strategies,legit,manage time better proven strategy,12.0,0.13,0.97,0.37
diy build bookshelf scratch,legit,follow easy step build sturdy bookshelf home,5.0,0.99,0.91,0.37
healthy meal prep ideas busy schedules,legit,prepare nutritious meal quickly timesaving tip,3.0,0.97,0.98,0.02
stay fit without gym membership,legit,stay shape effective home fitness routine,18.0,0.79,0.19,0.43
explore benefits renewable energy,legit,learn renewable energy positively impact environment,3.0,0.79,0.33,0.73
ten fun science facts kids,legit,discover amazing fun science fact kid love,23.0,0.31,0.99,0.89
top five strategies effective team management,legit,improve teamwork essential team management technique,13.0,0.37,0.65,0.95
build personal fitness plan,legit,create personalized fitness plan tailored goal,10.0,0.03,0.36,0.55
learn video editing like pro,legit,master professional video editing technique ease,13.0,0.5,0.52,0.9
ten things didnt know oceans,legit,explore fascinating fact world ocean,23.0,0.64,0.5,0.35
learn code python thirty days,legit,become proficient python programming one month,8.0,0.75,0.45,0.53
effective study techniques students,legit,boost academic performance study strategy,22.0,0.75,0.91,0.76
beginners guide investing stocks,legit,learn basic stock investing grow wealth,23.0,0.29,0.94,0.06
introduction machine learning algorithms,legit,understand fundamental machine learning algorithm,2.0,0.68,0.02,0.76
stay motivated challenging times,legit,stay positive motivated helpful strategy,14.0,0.02,0.88,0.22
learn meditate effectively,legit,improve mental health effective meditation technique,1.0,0.75,0.86,0.06
discover secrets wildlife photography,legit,capture breathtaking wildlife photo expert tip,16.0,0.72,0.95,0.06
learn video editing scratch,legit,master basic video editing beginnerfriendly guide,5.0,0.19,1.0,0.8
data compromised act fast,scam,immediate action required protect data,14.0,0.08,0.25,0.54
explore best hiking trails south america,legit,discover breathtaking hiking trail across south america,15.0,0.57,0.27,0.54
son0mmgo6vr2rbo6ixhnjnvvem2r8qc,scam,grab free cryptocurrency token http://free-airdrop.com,4.0,0.6,0.05,0.13
become millionaire one trick,scam,unlock secret becoming millionaire quickly,4.0,0.8,0.9,0.5
master digital marketing thirty days,legit,enhance marketing skill 30day comprehensive guide,21.0,0.5,0.52,0.64
claim exclusive reward midnight,scam,reward waiting claim midnight,17.0,0.97,0.15,0.87
stepbystep guide building website,legit,build professional website scratch easy guide,9.0,0.49,0.45,0.08
ten simple recipes quick dinners,legit,cook delicious dinner minute quick recipe,4.0,0.06,0.19,0.79
attention urgent security update required,scam,update security setting avoid risk,13.0,0.27,0.51,0.55
earn passive income hidden method,scam,discover hidden method generate passive income easily,8.0,0.07,0.54,0.88
five easy ways save money every month,legit,simple strategy save money effectively every month,13.0,0.5,0.52,0.36
best practices data security online,legit,protect online presence security practice,15.0,0.54,0.49,0.9
instant wealth awaits click learn,scam,path instant wealth begin act,12.0,0.72,0.52,0.55
master basics artificial intelligence,legit,learn core concept artificial intelligence stepbystep,17.0,0.96,0.93,0.36
act limited time bonus offer,scam,claim bonus time run,17.0,0.43,0.25,0.01
improve writing skills tips,legit,enhance writing ability practical advice,7.0,0.06,0.52,0.24
vip access limited slots available,scam,secure vip slot limited spot left,15.0,0.26,0.69,0.26
top seven fitness exercises beginners,legit,start fitness journey simple exercise,18.0,0.5,0.52,0.4
payment details outdated update,scam,update payment detail immediately http://secure-payment.com,13.0,0.38,0.04,0.8
attention suspicious login attempt detected,scam,secure account prevent unauthorized access,15.0,0.54,0.33,0.87
top secret financial freedom blueprint revealed,scam,unlock blueprint achieving financial freedom,11.0,0.23,0.48,0.54
plan effective study routine,legit,organize study schedule efficiently tip,9.0,0.63,0.52,0.94
unlock hidden earnings one click,scam,access hidden earning strategy one simple click,0.0,0.71,0.28,0.21
double money twenty-four hours guaranteed,scam,invest see money double within twenty-four hour,15.0,0.57,0.19,0.9
top ten tourist attractions asia,legit,explore mustvisit tourist attraction across asia,1.0,0.96,0.39,0.79
five easy ways save money every month,legit,simple effective method save money every month,11.0,0.55,0.3,0.8
exclusive invitation join millionaire club,scam,exclusive invitation waiting join,15.0,0.5,0.52,0.0
