title,label,description,upload_hour,likes,dislikes,comments
ten essential skills remote workers,legit,boost productivity essential remote working skill,9.0,0.24,0.12,0.31
act claim special reward,scam,claim reward instantly http://special-reward.net,7.0,0.45,0.66,0.38
urgent account risk fix,scam,account compromised secure immediately,9.0,0.69,0.52,0.81
beginners guide organic gardening,legit,start organic gardening journey easy guide,20.0,0.5,0.01,0.63
final warning account suspension imminent,scam,take immediate action avoid account suspension,15.0,0.49,0.07,0.01
stepbystep guide building website,legit,follow guide create first website scratch,8.0,0.87,0.64,0.22
start earning five hundred day starting,scam,learn earn five hundred daily proven strategy,21.0,0.47,0.15,0.79
new investment scheme earn big returns,scam,start investing today guaranteed high return,16.0,0.5,0.18,0.31
computer infected fix,scam,protect system act fast,0.0,0.08,0.43,0.69
top five strategies effective team management,legit,manage team effectively proven strategy,1.0,0.84,0.31,0.82
double earnings instantly,scam,boost income instantly http://fast-earnings.com,5.0,0.9,0.84,0.43
understanding science behind nutrition,legit,explore nutrition impact health essential insight,23.0,0.5,0.27,0.84
build emergency fund,legit,learn practical step create maintain emergency fund,16.0,0.2,0.73,0.53
ten diy projects home,legit,fun creative diy project enhance living space,8.0,0.5,0.17,0.97
tips creating engaging social media content,legit,boost social medium presence actionable tip,9.0,0.49,0.09,0.08
stepbystep guide podcasting,legit,start podcast detailed stepbystep guide,23.0,0.27,0.28,0.54
ten travel hacks save money flights,legit,save money next trip flight booking hack,2.0,0.71,0.76,0.79
stay motivated work,legit,learn strategy stay focused motivated workplace,7.0,0.41,1.0,0.6
quick workout routines busy professionals,legit,stay fit quick efficient workout routine,6.0,0.52,0.96,0.21
best tools improving productivity,legit,maximize productivity essential tool,4.0,0.62,0.05,0.39
introduction financial planning young adults,legit,learn plan finance effectively young adult,15.0,0.56,0.48,0.77
discover benefits meditation,legit,unlock mental physical benefit daily meditation,21.0,0.48,0.98,0.71
build confidence public speaking,legit,improve public speaking skill proven technique,10.0,0.73,0.81,0.81
learn write resume stands,legit,craft compelling resume catch recruiter attention,8.0,0.31,0.85,0.61
mastering video conferencing tools,legit,learn use video conferencing tool effectively remote meeting,20.0,0.93,0.01,0.13
best practices cybersecurity awareness,legit,protect digital asset cybersecurity tip,9.0,0.5,0.0,0.18
learn ethical hacking basics,legit,get started ethical hacking cybersecurity essential,9.0,0.72,0.1,0.22
quick tips learning new language,legit,master basic language quick tip,9.0,0.88,0.31,0.74
overcome procrastination,legit,defeat procrastination effective strategy,13.0,0.87,0.28,0.51
discover basics machine learning,legit,understand fundamental concept machine learning,2.0,0.88,0.49,0.24
understanding cryptocurrency beginners,legit,learn essential cryptocurrency blockchain technology,1.0,0.07,0.33,0.79
ten effective time management strategies,legit,boost productivity effective time management technique,19.0,0.12,0.17,0.64
bake perfect bread home,legit,master art baking delicious bread home,13.0,0.67,0.98,0.68
simple tips better sleep,legit,improve sleep quality simple yet effective tip,22.0,0.46,0.94,0.34
learn code mobile app sixty days,legit,build first mobile app stepbystep sixty day,14.0,0.21,0.18,0.85
build passive income stream,legit,create sustainable passive income source method,22.0,0.12,0.86,0.12
discover art photography,legit,learn secret capturing stunning photograph,8.0,0.77,0.16,0.3
create budget stick,legit,take control finance effective budgeting technique,22.0,0.36,0.2,0.8
top five books personal development,legit,fuel growth mustread personal development book,13.0,0.61,0.09,0.28
explore world virtual reality,legit,dive immersive experience virtual reality,13.0,0.63,0.25,0.3
understanding basics cloud computing,legit,learn cloud computing power modern technology solution,7.0,0.81,0.15,0.06
effective techniques stress management,legit,reduce stress proven relaxation technique,19.0,0.15,0.86,0.85
start freelance career successfully,legit,launch freelance career essential tip,8.0,0.5,0.52,0.16
explore history ancient civilizations,legit,travel back time uncover ancient secret,10.0,0.74,0.52,0.68
learn design logo photoshop,legit,master logo design using photoshop stepbystep,12.0,0.5,0.93,0.48
build strong professional relationships,legit,strengthen professional network strategy,7.0,0.73,0.33,0.42
ten life hacks everyday problems,legit,simplify daily life creative life hack,2.0,0.66,0.31,0.86
ten steps start business,legit,follow step launch business successfully,22.0,0.12,0.71,0.86
master basics graphic design,legit,start graphic design journey essential tip,12.0,0.86,0.42,0.64
learn fundamentals project management,legit,understand key principle successful project management,20.0,0.5,0.52,0.1
plan effective study routine,legit,boost academic success wellstructured study routine,20.0,0.83,0.18,0.95
learn basics seo beginners,legit,master fundamental seo improve website ranking,0.0,0.78,0.76,0.43
earn ten thousand one week skills needed,scam,start earning today zero experience act http://easy-earnings.com,20.0,0.74,0.52,0.75
ten tips effective email communication,legit,improve professional communication email strategy,0.0,0.52,0.34,0.78
quick easy vegan meal prep ideas,legit,prepare delicious healthy vegan meal time,23.0,0.13,0.52,0.46
learn make money online fast,scam,discover fastest way earn money online dont miss,19.0,0.5,0.25,0.15
best practices remote team collaboration,legit,boost team productivity remote collaboration tip,3.0,0.94,0.65,0.04
stepbystep guide interior design basics,legit,learn design beautiful functional space home,13.0,0.92,0.87,0.69
top five tools effective content marketing,legit,maximize content strategy essential tool,7.0,1.0,0.88,0.73
lottery simple trick,scam,discover trick could change life overnight,22.0,0.49,0.02,0.06
