title,label,description,upload_hour,likes,dislikes,comments
cook pasta ten minutes,legit,No link available,20.0,29187.0,2101.0,4003.0
free iphone giveaway click,scam,http://scam-website.com,11.0,99399.0,9827.0,965.0
win brand new tesla enter,scam,http://tesla-giveaway.com,11.0,38331.0,3574.0,824.0
discover secrets success,legit,No link available,10.0,11243.0,801.0,8093.0
warning account compromised,scam,http://security-alert.com,21.0,47063.0,5698.0,5594.0
learn python programming beginner advanced,legit,No link available,0.0,36959.0,8379.0,7953.0
get rich quick simple trick,scam,http://fakeprofits.net,15.0,50424.0,5186.0,1901.0
five easy exercises healthier life,legit,No link available,13.0,49933.0,3630.0,100.0
click claim reward,scam,http://reward-link.com,19.0,67550.0,1317.0,8486.0
shocking discovery banks dont want know,scam,http://bank-secrets.com,15.0,53616.0,2958.0,5028.0
computer risk fix,scam,http://quickfix.com,2.0,12119.0,3144.0,5394.0
top ten travel destinations two thousand and twenty-four,legit,No link available,19.0,50424.0,5186.0,588.0
account deleted twenty-four hours,scam,http://urgentfix.net,22.0,22941.0,4162.0,2983.0
ten facts didnt know space,legit,No link available,4.0,99983.0,7338.0,4874.0
become python expert thirty days,legit,No link available,19.0,38801.0,491.0,4827.0
immediate action required secure funds,scam,http://safe-bank.com,10.0,87361.0,8806.0,2084.0
new ai technology changes everything,legit,No link available,8.0,6611.0,214.0,5200.0
congratulations youve one thousand gift card,scam,http://prizezone.net,16.0,13257.0,3977.0,7572.0
get brand new laptop free,scam,http://free-laptop.org,13.0,9984.0,6628.0,5855.0
understanding machine learning algorithms,legit,No link available,8.0,43485.0,3385.0,9585.0
win free gift card limited time,scam,http://freeswag.com,15.0,30821.0,2548.0,3645.0
master art public speaking,legit,No link available,4.0,2271.0,4982.0,6777.0
credit score danger click,scam,http://credit-fix.net,2.0,36694.0,3409.0,7696.0
exclusive offer double money instantly,scam,http://fast-doubles.com,14.0,18646.0,9629.0,9096.0
tips successful job interview,legit,No link available,18.0,93214.0,2674.0,9366.0
youve click claim reward,scam,http://you-win.com,21.0,50424.0,5186.0,1774.0
diy build treehouse backyard,legit,No link available,10.0,25501.0,5352.0,7215.0
instant approval five thousand loan,scam,http://loan-fast.net,19.0,64950.0,8054.0,6610.0
claim reward midnight,scam,http://midnight-prize.net,13.0,76875.0,159.0,7817.0
explore hidden wonders world,legit,No link available,1.0,29927.0,8171.0,3070.0
last chance claim prize,scam,http://finalchance.net,6.0,17206.0,1815.0,8762.0
unlock secret instant wealth,scam,http://wealth-secret.net,17.0,29863.0,6002.0,9889.0
watch video gets removed,scam,http://hidden-video.net,9.0,51073.0,2013.0,5650.0
upgrade skills tutorial,legit,No link available,14.0,7391.0,1099.0,5170.0
earn money sleep,scam,http://moneydream.net,17.0,13795.0,9803.0,686.0
understanding blockchain technology,legit,No link available,16.0,89292.0,8614.0,5394.0
earn ten thousand one day guaranteed,scam,http://quick-rich.com,2.0,6613.0,4953.0,6512.0
win big purchase required,scam,http://win-big.com,10.0,48504.0,1059.0,6757.0
secret investment opportunity revealed,scam,http://invest-secrets.com,21.0,18796.0,9364.0,9947.0
hurry limited time offer ends soon,scam,http://final-offer.com,17.0,4286.0,3485.0,5589.0
free money click find,scam,http://free-cash.info,21.0,50424.0,824.0,9905.0
selected special reward,scam,http://exclusive-reward.com,8.0,67220.0,409.0,9471.0
secret formula quick money revealed,scam,http://quick-money.net,16.0,39145.0,5717.0,6748.0
shocking discovery banks dont want know,scam,http://bank-secrets.com,14.0,21490.0,3802.0,9072.0
top five coding languages learn two thousand and twenty-four,legit,No link available,14.0,32551.0,4724.0,1766.0
exclusive crypto trading secrets revealed,scam,http://crypto-secrets.net,17.0,46531.0,7172.0,5394.0
upgrade skills tutorial,legit,No link available,15.0,79587.0,9696.0,7913.0
save money efficiently,legit,No link available,11.0,34810.0,2182.0,7997.0
earn passive income zero investment,scam,http://passive-wealth.net,7.0,36983.0,8692.0,7994.0
win free holiday package limited time,scam,http://freeholiday.net,9.0,44159.0,9297.0,6080.0
healthy recipes busy people,legit,No link available,2.0,17511.0,5343.0,7536.0
understanding cryptocurrency basics,legit,No link available,17.0,94479.0,7563.0,3679.0
act prize waiting,scam,http://exclusive-reward.com,9.0,35181.0,2316.0,7176.0
double investment overnight secret,scam,No link available,3.0,57452.0,1218.0,9112.0
improve mental health tips,legit,No link available,6.0,83142.0,4958.0,2606.0
master art public speaking,legit,No link available,9.0,34213.0,9737.0,1993.0
warning unauthorized login detected,scam,http://secure-login.com,2.0,43972.0,1968.0,8658.0
top ten cities visit summer,legit,No link available,13.0,86878.0,8673.0,7975.0
device compromised fix immediately,scam,http://secure-device.net,7.0,50424.0,5186.0,7073.0
last chance vip access millionaire club,scam,http://millionaire-club.com,17.0,50424.0,5186.0,9897.0
understanding blockchain technology,legit,No link available,16.0,77135.0,3549.0,1893.0
congratulations youve selected special gift,scam,http://special-gift.net,16.0,48557.0,9304.0,1807.0
understanding renewable energy sources,legit,No link available,16.0,4316.0,430.0,3977.0
immediate action required avoid penalties,scam,http://penalty-alert.com,18.0,31053.0,1679.0,5394.0
top five hacks make money online instantly,scam,No link available,22.0,85421.0,6402.0,151.0
claim five hundred bonus late,scam,http://bonus-now.com,13.0,96072.0,3470.0,2760.0
top five coding languages learn two thousand and twenty-four,legit,No link available,1.0,3658.0,1575.0,3177.0
ultimate fitness guide beginners,legit,No link available,4.0,50424.0,5215.0,9747.0
earn five thousand per week home skills needed,scam,http://work-from-home.com,16.0,11112.0,9333.0,4078.0
comprehensive guide digital marketing,legit,No link available,15.0,79544.0,5412.0,1912.0
shocking truth online banking watch,scam,http://banking-truth.net,13.0,49901.0,3174.0,1796.0
limited slots available reserve,scam,No link available,22.0,69216.0,5855.0,1071.0
explore hidden wonders world,legit,No link available,22.0,31284.0,2576.0,8191.0
best books read year,legit,No link available,2.0,74810.0,8229.0,9881.0
subscription suspended reactivate,scam,http://subscription-alert.com,11.0,39823.0,5186.0,2207.0
tips successful job interview,legit,No link available,5.0,14793.0,8665.0,5247.0
exclusive investment tips instant wealth,scam,No link available,2.0,8490.0,7146.0,7637.0
unboxing latest iphone model,legit,No link available,5.0,221.0,9047.0,7304.0
plan perfect vacation,legit,No link available,13.0,74337.0,6929.0,3196.0
top five skills need two thousand and twenty-four,legit,No link available,4.0,50424.0,5186.0,2038.0
password leaked update,scam,No link available,22.0,81967.0,2112.0,5640.0
ultimate guide healthy meal prep,legit,No link available,17.0,59694.0,3455.0,9529.0
act avoid account suspension,scam,No link available,18.0,86083.0,5186.0,2277.0
best practices learning new language,legit,No link available,6.0,10621.0,718.0,9242.0
unbelievable deal buy one get five free,scam,http://exclusive-deal.net,13.0,50424.0,7651.0,2866.0
rcurlturtae ntwaflosecf eesrseca eso hac,legit,No link available,15.0,97388.0,7635.0,2007.0
instant approval personal loans credit check,scam,No link available,10.0,7832.0,8528.0,8620.0
understanding basics cybersecurity,legit,No link available,22.0,10283.0,4639.0,9725.0
free gift ready shipment,scam,No link available,4.0,50424.0,5186.0,1144.0
tips effective time management,legit,No link available,7.0,38591.0,6994.0,9139.0
secure account simple step,scam,No link available,17.0,17898.0,2279.0,5394.0
introduction artificial intelligence basics,legit,No link available,22.0,89037.0,3769.0,4205.0
ten quick tips improve memory,legit,No link available,9.0,50424.0,8034.0,3749.0
hidden secrets get rich fast revealed,scam,No link available,1.0,30160.0,7206.0,171.0
beginners guide graphic design,legit,No link available,8.0,85461.0,118.0,3244.0
exploring future renewable energy,legit,No link available,1.0,50415.0,6948.0,2437.0
important update payment information,scam,No link available,13.0,34969.0,460.0,1844.0
simple steps improve public speaking skills,legit,No link available,23.0,88007.0,2070.0,6842.0
ten proven methods save money,legit,No link available,19.0,7329.0,8330.0,8916.0
immediate refund available click,scam,No link available,9.0,28900.0,5514.0,5394.0
learn fundamentals photography,legit,No link available,23.0,39131.0,7632.0,5394.0
write winning resume,legit,No link available,6.0,59025.0,7310.0,4605.0
win prizes worth ten thousand enter today,scam,http://win-prizes-now.com,12.0,44307.0,1132.0,306.0
master data science six months,legit,No link available,15.0,27027.0,5146.0,4332.0
exclusive opportunity boss,scam,No link available,4.0,91271.0,140.0,1178.0
learn guitar thirty days,legit,No link available,19.0,93565.0,283.0,2357.0
essential tools remote work success,legit,No link available,11.0,61760.0,5186.0,2287.0
top seven places visit europe year,legit,No link available,11.0,62482.0,3714.0,7316.0
shocking truth online banking watch,scam,No link available,16.0,98428.0,1611.0,5394.0
ultimate beginners guide yoga,legit,No link available,13.0,36743.0,9537.0,3311.0
click activate free gift,scam,No link available,5.0,50424.0,5186.0,338.0
simple habits productive day,legit,No link available,0.0,44468.0,7284.0,3243.0
act quickly claim reward today,scam,No link available,19.0,71454.0,8873.0,8905.0
understanding cryptocurrency wallets,legit,No link available,5.0,14135.0,4725.0,5850.0
congratulations youve surprise gift,scam,http://surprise-gift.net,3.0,41311.0,5221.0,5047.0
exploring depths ocean documentary,legit,No link available,20.0,72812.0,2325.0,1284.0
top three ways become millionaire,scam,No link available,0.0,60889.0,5186.0,8886.0
device risk fix instantly,scam,No link available,14.0,19135.0,1137.0,5040.0
free access exclusive content,scam,No link available,14.0,37166.0,5186.0,3080.0
urgent verify account immediately,scam,No link available,15.0,75834.0,6120.0,1141.0
earn five hundred day strategy,scam,No link available,0.0,93690.0,8354.0,5394.0
understanding basics personal finance,legit,No link available,21.0,49664.0,9179.0,4974.0
get exclusive access secret wealth tips,scam,No link available,10.0,39266.0,8806.0,4321.0
immediate action required account security,scam,No link available,4.0,24935.0,8789.0,5105.0
ten quick recipes busy weeknights,legit,No link available,0.0,72150.0,5803.0,7993.0
win luxury car one click,scam,http://luxurycar-win.net,15.0,20565.0,8836.0,7844.0
special offer unlock premium content free,scam,No link available,13.0,20458.0,6343.0,7223.0
build confidence social situations,legit,No link available,16.0,50424.0,8326.0,4992.0
attention account needs verification,scam,No link available,13.0,94338.0,5186.0,5478.0
limited slots instant wealth program,scam,No link available,19.0,50424.0,756.0,4553.0
free bitcoin giveaway claim,scam,No link available,0.0,90513.0,1081.0,9541.0
act fast slots left,scam,No link available,15.0,68106.0,647.0,4913.0
get instant approval personal loan,scam,No link available,14.0,36264.0,8813.0,5394.0
learn ethical hacking step step,legit,No link available,14.0,33179.0,4390.0,9511.0
secure future one trick,scam,No link available,20.0,44328.0,3927.0,9663.0
last chance claim prize,scam,No link available,20.0,51483.0,7264.0,5394.0
easy diy projects home,legit,No link available,4.0,20442.0,5909.0,8731.0
alert suspicious activity detected account,scam,No link available,6.0,2617.0,4271.0,4494.0
limited time get free bonus,scam,No link available,10.0,50424.0,5186.0,4410.0
double investment overnight,scam,No link available,16.0,73482.0,5788.0,5394.0
shocking discovery online earnings,scam,No link available,6.0,50336.0,684.0,5778.0
uncover hidden investment secrets,scam,No link available,13.0,1340.0,7624.0,2712.0
build confidence social situations,legit,No link available,6.0,25600.0,5148.0,3359.0
get paid watching videos start today,scam,No link available,4.0,89189.0,294.0,4524.0
understanding basics personal finance,legit,No link available,13.0,55593.0,4273.0,5586.0
claim free access premium tools_,scam,No link available,16.0,56988.0,8308.0,6665.0
ultimate guide gardening beginners,legit,No link available,12.0,57633.0,9219.0,732.0
shocking secrets rich exposed,scam,No link available,23.0,28268.0,4146.0,9400.0
quick easy vegan recipes,legit,No link available,19.0,50424.0,2661.0,5350.0
top five secrets banks dont want know,scam,No link available,7.0,78389.0,7373.0,315.0
earn passive income effortlessly,scam,No link available,1.0,37206.0,4434.0,9373.0
master public speaking tips,legit,No link available,4.0,90.0,9221.0,8349.0
exclusive access fast money making tips,scam,No link available,22.0,18712.0,4454.0,2972.0
master photography seven days,legit,No link available,21.0,11858.0,5186.0,5394.0
explore wonders space nasa,legit,No link available,2.0,70168.0,8193.0,8496.0
immediate refund available act fast,scam,http://refund-quick.net,16.0,85968.0,5186.0,738.0
ten mindfulness techniques stress relief,legit,No link available,21.0,64719.0,8576.0,5603.0
account flagged suspicious activity,scam,No link available,16.0,62719.0,2594.0,6927.0
top ten mustvisit cities europe,legit,No link available,11.0,63327.0,9481.0,8698.0
stepbystep guide home renovation,legit,No link available,8.0,99075.0,5186.0,8371.0
attention limited time investment opportunity,scam,http://invest-now.com,21.0,11906.0,4124.0,4878.0
best hiking trails around world,legit,No link available,12.0,9294.0,5830.0,2848.0
top ten mustread books entrepreneurs,legit,No link available,19.0,50424.0,9844.0,5394.0
warning immediate action required account,scam,No link available,8.0,35172.0,8080.0,5750.0
unlock financial freedom today,scam,No link available,8.0,41698.0,7268.0,2424.0
build successful online business,legit,No link available,20.0,21434.0,3943.0,9649.0
limited offer double money instantly,scam,No link available,13.0,40023.0,9881.0,8478.0
best practices cybersecurity two thousand and twenty-four,legit,No link available,20.0,63912.0,5357.0,6204.0
top five tools effective project management,legit,No link available,10.0,47440.0,5186.0,7155.0
discover secrets instant success,scam,No link available,20.0,82239.0,5015.0,9776.0
five daily habits healthier lifestyle,legit,No link available,6.0,87543.0,6697.0,2274.0
security risk click fix,scam,http://security-fix.com,6.0,50424.0,2623.0,9956.0
simple exercises better posture,legit,No link available,18.0,73104.0,5683.0,897.0
join vip club exclusive benefits,scam,No link available,15.0,18110.0,6320.0,5394.0
quick cash make two hundred thirty minutes,scam,No link available,20.0,60698.0,5186.0,3828.0
start earning home right,scam,No link available,16.0,89568.0,4867.0,6196.0
learn spanish thirty days beginner guide,legit,No link available,19.0,41297.0,6851.0,5678.0
improve digital marketing skills,legit,No link available,1.0,38154.0,8672.0,7168.0
exclusive insider trading secrets revealed,scam,No link available,5.0,41664.0,3802.0,1410.0
alert payment details outdated,scam,No link available,16.0,31638.0,5088.0,8866.0
claim instant reward,scam,No link available,0.0,64803.0,6183.0,5171.0
new method get rich fast revealed,scam,No link available,17.0,50424.0,5186.0,9954.0
learn basic first aid skills,legit,No link available,12.0,55881.0,6504.0,44.0
stepbystep guide writing novel,legit,No link available,22.0,39282.0,3824.0,7450.0
exclusive deal win free ipad today,scam,http://free-ipad.net,9.0,6876.0,5186.0,616.0
top five productivity tools remote work,legit,No link available,19.0,17663.0,9876.0,4459.0
earn one thousand daily without leaving home,scam,No link available,2.0,50424.0,5186.0,6206.0
ten tips becoming better writer,legit,No link available,13.0,566.0,836.0,9455.0
plan dream vacation,legit,No link available,22.0,38271.0,6120.0,2548.0
best practices managing remote teams,legit,No link available,19.0,5022.0,9156.0,9064.0
stepbystep guide learning guitar,legit,No link available,1.0,59674.0,90.0,6635.0
bank account locked immediate action needed,scam,http://secure-bank.net,19.0,97011.0,3339.0,5933.0
easy diy crafts kids,legit,No link available,2.0,74576.0,9085.0,4644.0
ten affordable smart home gadgets,legit,No link available,15.0,92038.0,7446.0,363.0
learn art graphic design,legit,No link available,22.0,51314.0,2017.0,3091.0
launch startup successfully,legit,No link available,16.0,61405.0,314.0,5591.0
best practices email marketing campaigns,legit,No link available,9.0,99171.0,5632.0,5604.0
top five online courses career growth,legit,No link available,21.0,93997.0,5611.0,3468.0
improve focus techniques,legit,No link available,13.0,23758.0,1043.0,621.0
ten science experiments home,legit,No link available,11.0,47496.0,8519.0,8190.0
congratulations youve dream vacation,scam,http://dream-vacation.net,1.0,81246.0,6311.0,7999.0
discover best travel hacks flights,legit,No link available,13.0,81341.0,9240.0,3241.0
top seven time management strategies,legit,No link available,12.0,13077.0,9597.0,3689.0
diy build bookshelf scratch,legit,No link available,5.0,98909.0,8970.0,3710.0
healthy meal prep ideas busy schedules,legit,No link available,3.0,96600.0,9648.0,269.0
stay fit without gym membership,legit,No link available,18.0,79421.0,1857.0,4324.0
explore benefits renewable energy,legit,No link available,3.0,78752.0,3229.0,7278.0
ten fun science facts kids,legit,No link available,23.0,31531.0,9760.0,8847.0
top five strategies effective team management,legit,No link available,13.0,36632.0,6451.0,9482.0
build personal fitness plan,legit,No link available,10.0,2997.0,3596.0,5448.0
learn video editing like pro,legit,No link available,13.0,50424.0,5186.0,8976.0
ten things didnt know oceans,legit,No link available,23.0,64026.0,4949.0,3467.0
learn code python thirty days,legit,No link available,8.0,75319.0,4408.0,5308.0
effective study techniques students,legit,No link available,22.0,74851.0,8984.0,7560.0
beginners guide investing stocks,legit,No link available,23.0,29430.0,9278.0,601.0
introduction machine learning algorithms,legit,No link available,2.0,68070.0,228.0,7597.0
stay motivated challenging times,legit,No link available,14.0,2366.0,8734.0,2224.0
learn meditate effectively,legit,No link available,1.0,74890.0,8535.0,599.0
discover secrets wildlife photography,legit,No link available,16.0,72236.0,9415.0,621.0
learn video editing scratch,legit,No link available,5.0,18638.0,9879.0,7959.0
data compromised act fast,scam,No link available,14.0,7717.0,2485.0,5394.0
explore best hiking trails south america,legit,No link available,15.0,56954.0,2630.0,5436.0
become millionaire one trick,scam,No link available,4.0,80382.0,8935.0,5046.0
master digital marketing thirty days,legit,No link available,21.0,50424.0,5186.0,6399.0
claim exclusive reward midnight,scam,No link available,17.0,97179.0,1454.0,8708.0
stepbystep guide building website,legit,No link available,9.0,48821.0,4491.0,882.0
ten simple recipes quick dinners,legit,No link available,4.0,6345.0,1877.0,7915.0
attention urgent security update required,scam,No link available,13.0,27171.0,5052.0,5506.0
earn passive income hidden method,scam,No link available,8.0,7324.0,5360.0,8761.0
five easy ways save money every month,legit,No link available,13.0,50424.0,5186.0,3635.0
best practices data security online,legit,No link available,15.0,54115.0,4883.0,8928.0
instant wealth awaits click learn,scam,No link available,12.0,71999.0,5145.0,5510.0
master basics artificial intelligence,legit,No link available,17.0,95994.0,9235.0,3600.0
act limited time bonus offer,scam,No link available,17.0,43164.0,2480.0,134.0
improve writing skills tips,legit,No link available,7.0,5799.0,5186.0,2454.0
vip access limited slots available,scam,No link available,15.0,25770.0,6846.0,2659.0
top seven fitness exercises beginners,legit,No link available,18.0,50424.0,5186.0,4040.0
payment details outdated update,scam,http://secure-payment.com,13.0,38386.0,432.0,7990.0
attention suspicious login attempt detected,scam,No link available,15.0,53953.0,3224.0,8657.0
top secret financial freedom blueprint revealed,scam,No link available,11.0,22581.0,4745.0,5394.0
plan effective study routine,legit,No link available,9.0,62807.0,5157.0,9344.0
unlock hidden earnings one click,scam,No link available,0.0,71112.0,2774.0,2126.0
double money twenty-four hours guaranteed,scam,No link available,15.0,56788.0,1860.0,8939.0
top ten tourist attractions asia,legit,No link available,1.0,95523.0,3881.0,7913.0
five easy ways save money every month,legit,No link available,11.0,55385.0,2925.0,7961.0
exclusive invitation join millionaire club,scam,No link available,15.0,50424.0,5186.0,93.0
ten essential skills remote workers,legit,No link available,9.0,23958.0,1190.0,3153.0
act claim special reward,scam,http://special-reward.net,7.0,44751.0,6483.0,3830.0
urgent account risk fix,scam,No link available,9.0,68687.0,5186.0,8056.0
beginners guide organic gardening,legit,No link available,20.0,50495.0,108.0,6265.0
final warning account suspension imminent,scam,No link available,15.0,49410.0,658.0,120.0
stepbystep guide building website,legit,No link available,8.0,86824.0,6343.0,2230.0
start earning five hundred day starting,scam,No link available,21.0,47171.0,1457.0,7857.0
new investment scheme earn big returns,scam,No link available,16.0,50424.0,1823.0,3078.0
computer infected fix,scam,No link available,0.0,7608.0,4260.0,6846.0
top five strategies effective team management,legit,No link available,1.0,83606.0,3040.0,8191.0
double earnings instantly,scam,http://fast-earnings.com,5.0,89952.0,8310.0,4278.0
understanding science behind nutrition,legit,No link available,23.0,50424.0,2666.0,8398.0
build emergency fund,legit,No link available,16.0,20292.0,7217.0,5296.0
ten diy projects home,legit,No link available,8.0,50424.0,1711.0,9625.0
tips creating engaging social media content,legit,No link available,9.0,49254.0,878.0,880.0
stepbystep guide podcasting,legit,No link available,23.0,27112.0,2819.0,5442.0
ten travel hacks save money flights,legit,No link available,2.0,70625.0,7550.0,7900.0
stay motivated work,legit,No link available,7.0,41221.0,9849.0,5992.0
quick workout routines busy professionals,legit,No link available,6.0,52007.0,9532.0,2119.0
best tools improving productivity,legit,No link available,4.0,62002.0,495.0,3923.0
introduction financial planning young adults,legit,No link available,15.0,55708.0,4754.0,7724.0
discover benefits meditation,legit,No link available,21.0,47550.0,9726.0,7070.0
build confidence public speaking,legit,No link available,10.0,72611.0,8009.0,8089.0
learn write resume stands,legit,No link available,8.0,30753.0,8351.0,6052.0
mastering video conferencing tools,legit,No link available,20.0,93429.0,115.0,1354.0
best practices cybersecurity awareness,legit,No link available,9.0,50424.0,8.0,1848.0
learn ethical hacking basics,legit,No link available,9.0,72317.0,1036.0,2273.0
quick tips learning new language,legit,No link available,9.0,88467.0,3084.0,7428.0
overcome procrastination,legit,No link available,13.0,86824.0,2733.0,5113.0
discover basics machine learning,legit,No link available,2.0,88164.0,4842.0,2421.0
understanding cryptocurrency beginners,legit,No link available,1.0,6586.0,3271.0,7909.0
ten effective time management strategies,legit,No link available,19.0,11667.0,1662.0,6393.0
bake perfect bread home,legit,No link available,13.0,67492.0,9695.0,6815.0
simple tips better sleep,legit,No link available,22.0,46169.0,9321.0,3380.0
learn code mobile app sixty days,legit,No link available,14.0,21227.0,1754.0,8441.0
build passive income stream,legit,No link available,22.0,12091.0,8521.0,1210.0
discover art photography,legit,No link available,8.0,76516.0,1606.0,3038.0
create budget stick,legit,No link available,22.0,36318.0,1937.0,7982.0
top five books personal development,legit,No link available,13.0,61045.0,936.0,2850.0
explore world virtual reality,legit,No link available,13.0,62598.0,2517.0,3028.0
understanding basics cloud computing,legit,No link available,7.0,80866.0,1495.0,629.0
effective techniques stress management,legit,No link available,19.0,14789.0,8466.0,8442.0
start freelance career successfully,legit,No link available,8.0,50424.0,5186.0,1605.0
explore history ancient civilizations,legit,No link available,10.0,74321.0,5156.0,6786.0
learn design logo photoshop,legit,No link available,12.0,50424.0,9226.0,4818.0
build strong professional relationships,legit,No link available,7.0,73335.0,3275.0,4196.0
ten life hacks everyday problems,legit,No link available,2.0,65719.0,3035.0,8552.0
ten steps start business,legit,No link available,22.0,12406.0,7058.0,8617.0
master basics graphic design,legit,No link available,12.0,85799.0,4181.0,6344.0
learn fundamentals project management,legit,No link available,20.0,50424.0,5186.0,1082.0
plan effective study routine,legit,No link available,20.0,83205.0,1825.0,9430.0
learn basics seo beginners,legit,No link available,0.0,78417.0,7519.0,4332.0
earn ten thousand one week skills needed,scam,http://easy-earnings.com,20.0,73527.0,5132.0,7459.0
ten tips effective email communication,legit,No link available,0.0,52017.0,3318.0,7745.0
quick easy vegan meal prep ideas,legit,No link available,23.0,12823.0,5186.0,4598.0
learn make money online fast,scam,No link available,19.0,50424.0,2525.0,1564.0
best practices remote team collaboration,legit,No link available,3.0,93571.0,6396.0,478.0
stepbystep guide interior design basics,legit,No link available,13.0,91568.0,8608.0,6892.0
top five tools effective content marketing,legit,No link available,7.0,99738.0,8673.0,7237.0
lottery simple trick,scam,No link available,22.0,49238.0,253.0,600.0
